<?xml version="1.0" encoding="UTF-8"?>
<!-- TEST FIXTURE. A trimmed excerpt of a real fread content export: Howard Pyle's
     "The Merry Adventures of Robin Hood" (1883), public domain, as the work element's
     own rights-state attribute records.

     Four of the book's twenty-six divisions, lifted verbatim, because this is the shape
     of document fux is actually used on and the other fixtures are not: ~190 blocks,
     six attributes apiece, holding escaped HTML as text, plus empty illustration
     elements. Long enough that the tree scrolls many times over, which is exactly what
     a one-screen fixture cannot exercise. A clipped list or a lost scroll position is
     invisible in a document that fits on one screen, and both have shipped.

     export-state no longer describes this file: it is the hash the full export carried,
     and trimming did not update it. Nothing in fux reads it.

     The full 1 MB book is deliberately not in the repo. Point the drill at a copy for
     performance work (issue #2): make drill FILE=/path/to/robin-hood.xml
-->
<!-- fread content export.
     Identity attrs (id, anchor-id, ref, source-anchor) are stable internal
     handles — do not hand-edit them. On a DETACHED work they are how an import
     recognises what it is looking at: an element keeping its id is matched and
     updated, an element with NO id attribute is an insert (the import mints the
     id, ordinal and ref for it), and an element deleted from this file is a
     delete. Existing anchors are never renumbered, so refs on a detached work
     are addresses, not a sort order — document order is what you see here.
     On a TRACKING work this file is read-only reference: `kind` is the one
     attribute reapplicable durably, via `ingest-override set`.
     A block's content is its AUTHORED form (content_block.text_html), so inline
     markup arrives escaped (&lt;i&gt;). The plain-text form is derived from it on
     import and is deliberately not exported, so the two cannot disagree. A block
     marked text-form="plain" has no HTML form at all; leave the marker alone.
     <illustration> elements mark where an image attaches — nested in the block
     (or at the top of the division) whose anchor-id they match. source-ref is the
     stable key for `ingest-override role`; role is the role in effect. A
     role-pending attr means an override recorded a different role that has not
     taken effect yet (roles apply at the next ingest); `fread-admin work detach`
     bakes it in, since detaching ends re-ingest for good.
     A division with rendered="false" is suppressed from the reader by default
     (an embedded table of contents, redundant with the navigation drawer); it
     stays in the store. See FreadClassicIngestionTool.md §8.8. -->
<work xmlns:xsi="http://www.w3.org/2001/XMLSchema-instance" xsi:noNamespaceSchemaLocation="fread-content-export-3.xsd" export-schema="fread-content-export/3" export-state="sha256:a89a8aa7f4d7e9e91292ac881da7b660141619e4e99872efdfc9eba46079c2b7" id="019f6db7-18fd-7213-a1d7-6e0113dc53ed" title="The Merry Adventures of Robin Hood" attribution="Pyle, Howard" rights-state="public-domain">
  <division id="21dde553-d22b-4a3e-8cdc-fbf19e18eb81" ref="front-matter" kind="title-page" ordinal="1" depth="0" source-anchor="front-matter" anchor-id="7037ce02-3cdc-4b66-88ac-0590393c7f76">
    <block id="178fdc27-4310-496e-98f8-bdd93cde8104" ref="front-matter.p1" kind="heading" ordinal="1" anchor-id="dfb1e803-946e-4bda-944b-1baddd12e8da" source-offset="1">&lt;h1&gt;
    THE MERRY ADVENTURES OF ROBIN HOOD
&lt;/h1&gt;</block>
    <block id="aef41c23-01bf-4a3d-bfd7-cfad4786864b" ref="front-matter.p2" kind="heading" ordinal="2" anchor-id="4be87c71-8219-43cf-8b39-2a2faf649724" source-offset="2">&lt;h2&gt;
by Howard Pyle
&lt;/h2&gt;</block>
  </division>
  <division id="8015e84f-e1f9-41a9-ae7b-249b979ccebf" ref="id_2H_4_0004" kind="chapter" ordinal="6" depth="0" title="The Shooting Match at Nottingham Town" source-anchor="id_2H_4_0004" anchor-id="93c190c8-f8e7-41c9-a2d5-4fd57ff4f7a4">
    <illustration item-id="01a012a0-d3ff-7474-a0c3-6fd4dc2c3185" blob-id="01a012a0-d40e-71b9-8248-782f08db2065" source-ref="images/crops/shooting_frontplate.jpg" anchor-id="93c190c8-f8e7-41c9-a2d5-4fd57ff4f7a4" role="plate" print-placement="facing-chapter-open" alt="The Sheriff of Nottingham cometh before the King at London"></illustration>
    <illustration item-id="01a012a0-d3ff-7478-9831-14b4a4408e08" blob-id="01a012a0-d46a-73e8-9d8f-872310e1613b" source-ref="images/crops/shooting_headpiece.jpg" anchor-id="93c190c8-f8e7-41c9-a2d5-4fd57ff4f7a4" role="headpiece"></illustration>
    <block id="f3f172a8-e8dc-47b8-a59f-46ef75fcda8e" ref="id_2H_4_0004.p1" kind="paragraph" ordinal="1" anchor-id="9527e581-d041-45df-a147-3b57b84b9646" source-offset="1">
Then the Sheriff was very wroth because of this failure to take jolly
Robin, for it came to his ears, as ill news always does, that the people
laughed at him and made a jest of his thinking to serve a warrant upon
such a one as the bold outlaw. And a man hates nothing so much as
being made a jest of; so he said: "Our gracious lord and sovereign King
himself shall know of this, and how his laws are perverted and despised
by this band of rebel outlaws. As for yon traitor Tinker, him will
I hang, if I catch him, upon the very highest gallows tree in all
Nottinghamshire."
</block>
    <block id="72f8cc98-905e-40b3-bfbf-f1d73f73441f" ref="id_2H_4_0004.p2" kind="paragraph" ordinal="2" anchor-id="da6dc13c-313c-4609-9210-352d6dc7b15a" source-offset="2">
Then he bade all his servants and retainers to make ready to go to
London Town, to see and speak with the King.
</block>
    <block id="2b437d23-b5dc-451e-8fd6-117eb55240d7" ref="id_2H_4_0004.p3" kind="paragraph" ordinal="3" anchor-id="00832e06-9eb5-4d95-b771-a8c90b446860" source-offset="3">
At this there was bustling at the Sheriff's castle, and men ran hither
and thither upon this business and upon that, while the forge fires of
Nottingham glowed red far into the night like twinkling stars, for
all the smiths of the town were busy making or mending armor for the
Sheriff's troop of escort. For two days this labor lasted, then, on
the third, all was ready for the journey. So forth they started in the
bright sunlight, from Nottingham Town to Fosse Way and thence to Watling
Street; and so they journeyed for two days, until they saw at last the
spires and towers of great London Town; and many folks stopped, as
they journeyed along, and gazed at the show they made riding along the
highways with their flashing armor and gay plumes and trappings.
</block>
    <block id="97eec4ef-b77e-4849-bc8d-a167894fccea" ref="id_2H_4_0004.p4" kind="paragraph" ordinal="4" anchor-id="7bcc4753-1bde-498e-b0c3-8c2b068289e8" source-offset="4">
In London King Henry and his fair Queen Eleanor held their court, gay
with ladies in silks and satins and velvets and cloth of gold, and also
brave knights and gallant courtiers.
</block>
    <block id="be4582ab-56f4-4bcc-a051-a4ba65111623" ref="id_2H_4_0004.p5" kind="paragraph" ordinal="5" anchor-id="c1034aa4-ef99-46fe-b24c-6781fbe9b8b6" source-offset="5">
Thither came the Sheriff and was shown into the King's presence.
</block>
    <block id="a7d1b7d7-0810-4066-9ce5-b363e485d7b2" ref="id_2H_4_0004.p6" kind="paragraph" ordinal="6" anchor-id="db9cbed7-ba51-4e03-98fa-07e95f94541d" source-offset="6">
"A boon, a boon," quoth he, as he knelt upon the ground.
</block>
    <block id="56dd3241-574e-4142-aba7-c2ad2359965d" ref="id_2H_4_0004.p7" kind="paragraph" ordinal="7" anchor-id="c819d506-22e5-4d19-a432-0fa64c9f4481" source-offset="7">
"Now what wouldst thou have?" said the King. "Let us hear what may be
thy desires."
</block>
    <block id="acfc6393-3f31-45a4-9183-74064c0bc0bc" ref="id_2H_4_0004.p8" kind="paragraph" ordinal="8" anchor-id="17f2873d-4110-416b-902b-4e13da5377cb" source-offset="8">
"O good my Lord and Sovereign," spake the Sheriff, "in Sherwood Forest
in our own good shire of Nottingham, liveth a bold outlaw whose name is
Robin Hood."
</block>
    <block id="b478bcff-57a0-49e6-8c6e-d9c9f0c26260" ref="id_2H_4_0004.p9" kind="paragraph" ordinal="9" anchor-id="78f53b3d-6696-43c2-bea6-bd9d4f9c6520" source-offset="9">
"In good sooth," said the King, "his doings have reached even our own
royal ears. He is a saucy, rebellious varlet, yet, I am fain to own, a
right merry soul withal."
</block>
    <block id="d4158899-2345-4d72-875d-0af27265fb27" ref="id_2H_4_0004.p10" kind="paragraph" ordinal="10" anchor-id="117d260b-6e01-41e2-9ff6-ced3eda5a4ea" source-offset="10">
"But hearken, O my most gracious Sovereign," said the Sheriff. "I sent
a warrant to him with thine own royal seal attached, by a right lusty
knave, but he beat the messenger and stole the warrant. And he killeth
thy deer and robbeth thine own liege subjects even upon the great
highways."
</block>
    <block id="05228094-08e7-44a2-b560-10d3b6f56b72" ref="id_2H_4_0004.p11" kind="paragraph" ordinal="11" anchor-id="244d726c-b7ca-4328-9819-d7fb34a411b7" source-offset="11">
"Why, how now," quoth the King wrathfully. "What wouldst thou have
me do? Comest thou not to me with a great array of men-at-arms and
retainers, and yet art not able to take a single band of lusty knaves
without armor on breast, in thine own county! What wouldst thou have
me do? Art thou not my Sheriff? Are not my laws in force in
Nottinghamshire? Canst thou not take thine own course against those that
break the laws or do any injury to thee or thine? Go, get thee gone, and
think well; devise some plan of thine own, but trouble me no further.
But look well to it, Master Sheriff, for I will have my laws obeyed by
all men within my kingdom, and if thou art not able to enforce them thou
art no sheriff for me. So look well to thyself, I say, or ill may befall
thee as well as all the thieving knaves in Nottinghamshire. When the
flood cometh it sweepeth away grain as well as chaff."